{"assistant_evidence_schema_version":1,"created_at":"2026-01-02T00:00:00Z","generated_output":"Pre-trade risk rejected order: gross exposure of 105,000 USD exceeded account ceiling of 100,000 USD.","human_disposition":"ACCEPTED","model_version":"follon-copilot-v1","prompt_template_version":"risk-explainer-v1","query_id":"query.exp.7f2a","retrieved_record_ids":["risk.decision.v1","conf.risk.v1"],"tool_attempts":[{"arguments_hash":"2222222222222222222222222222222222222222222222222222222222222222","evidence_id":"risk.decision.v1","status":"SUCCESS","tool_name":"query_evidence"}],"uncertainty_score_bps":250}
